{
  "$schema": "./schemas/spec-manifest.schema.json",
  "corpora": {
    "engine": {
      "count": 67,
      "fixtures": "engine/fixtures",
      "format": "engine-fixture/v1",
      "schema": "engine/schemas/fixture.schema.json"
    },
    "exploration": {
      "count": 24,
      "fixtures": "exploration/fixtures",
      "format": "exploration-fixture/v1",
      "schema": "exploration/schemas/fixture.schema.json"
    },
    "notation": {
      "count": 36,
      "fixtures": "notation/fixtures",
      "format": "notation-fixture/v1",
      "schema": "notation/schemas/fixture.schema.json"
    }
  },
  "files": [
    {
      "bytes": 11,
      "path": "VERSION",
      "sha256": "8e3ccfbe492191dbb919be7b4ef3d93bd88f92b1d99532b25ba19c5ad9f1f722"
    },
    {
      "bytes": 1898,
      "path": "engine/ASPECTS.md",
      "sha256": "c3ffd886e12c4fae4abce8dcec50dd581c77b8c9e9188acd6ba3e804267e6838"
    },
    {
      "bytes": 7136,
      "path": "engine/CONTRACT.md",
      "sha256": "6b6ac5117254b1ec35e8c13f973e4d21d1484117b93902c255f2384fc695c2cf"
    },
    {
      "bytes": 7334,
      "path": "engine/README.md",
      "sha256": "0788585679e48a880c0bb60bf09c92a4bd1f12f75c840fa499bceb32d39cc6d0"
    },
    {
      "bytes": 2779,
      "path": "engine/WORKFLOW.md",
      "sha256": "e3c167332653a0468d9f3ec256391867de532bf825b3b428ab33dd3530f11091"
    },
    {
      "bytes": 317,
      "path": "engine/aspects/TEMPLATE.md",
      "sha256": "9fd1110ed1e673d4ac51fd9060d288fb8243b845f9901030d6c53bab2a80b332"
    },
    {
      "bytes": 492,
      "path": "engine/aspects/card-ordering.md",
      "sha256": "9820683ec453c4dd500a2d89bfbad163506d100119c156d44e64e27230dd80c8"
    },
    {
      "bytes": 937,
      "path": "engine/aspects/errors-and-invalid-actions.md",
      "sha256": "3f7d35af83fc9173f4afed521a1d9754ac0d6fd3e88654cbc1c9881bacd2ccf7"
    },
    {
      "bytes": 932,
      "path": "engine/aspects/hand-resolution.md",
      "sha256": "3f7a1f041accadcda3cd5929ef5f39fe8196f2f18c4917733537af9614180653"
    },
    {
      "bytes": 414,
      "path": "engine/aspects/hidden-cards.md",
      "sha256": "5c0d5cb3232bf258ae89719155251f649ad03d34942b4befcc44420b259f19d7"
    },
    {
      "bytes": 891,
      "path": "engine/aspects/invalid-states.md",
      "sha256": "b6999ef03f1244a45fa695d3417edd2b6cc6cec7308ed06294c12ad4ed573091"
    },
    {
      "bytes": 1221,
      "path": "engine/aspects/raises.md",
      "sha256": "f8c91fc125def461e93890a0e88d69cb5a539a6c5b18227aec7a7c9b90a521fe"
    },
    {
      "bytes": 1016,
      "path": "engine/aspects/round-resolution.md",
      "sha256": "1c8ad3d62e4b0a36c6005d0ccc55789b3ca4e1040d9ebe2c1dcacba8f1efca47"
    },
    {
      "bytes": 1525,
      "path": "engine/aspects/score-and-match-flow.md",
      "sha256": "68da0284c79c44548bdfa001f1eee04c2f04b0b8f891269aafec401911b955b2"
    },
    {
      "bytes": 1315,
      "path": "engine/aspects/turn-structure.md",
      "sha256": "27e34dcc372ccee87227594288a8add9ed78d28ecd3a1dec6c383ac8babe5fd7"
    },
    {
      "bytes": 1729,
      "path": "engine/fixtures/card-ordering/manilha-beats-non-manilha.json",
      "sha256": "42882b8fd5584b5e3830224bc290c7ceaa71b37582cb0001e0a086f682bcb1df"
    },
    {
      "bytes": 1737,
      "path": "engine/fixtures/card-ordering/manilha-suit-order.json",
      "sha256": "2e5e0ae0a1cefcc01c4309e0f7be233a5b8b6a29bb9bae0b695110ccb246fc9f"
    },
    {
      "bytes": 2177,
      "path": "engine/fixtures/card-ordering/non-manilha-same-rank-tie.json",
      "sha256": "22c6c63f308c2dc2d2b93112bfce16897a1e859bddea1d1510d917f248481678"
    },
    {
      "bytes": 1790,
      "path": "engine/fixtures/card-ordering/same-matchup-ignores-unused-cards.json",
      "sha256": "820ba4db628d68fdfce3cbc847b475baaf5c20502c120b1a5e4e2ccd57c79fc8"
    },
    {
      "bytes": 1753,
      "path": "engine/fixtures/card-ordering/stronger-non-manilha-beats-weaker.json",
      "sha256": "bbdecf55fb7f2a7dd4f8f21e1a8b2d80d779f2c23d6fdd09a230bd6476f35f06"
    },
    {
      "bytes": 1357,
      "path": "engine/fixtures/errors-and-invalid-actions/accept-raise-without-pending.json",
      "sha256": "77fa3e20c63ee5c08cef1afd80f43cec7093b8f248f60e5325bf6d1312a83d68"
    },
    {
      "bytes": 1361,
      "path": "engine/fixtures/errors-and-invalid-actions/card-not-in-hand.json",
      "sha256": "96fc7fc8e0598a3806374259b449ae43b290b0ae3619c608758ec3ed3c46cfb6"
    },
    {
      "bytes": 1337,
      "path": "engine/fixtures/errors-and-invalid-actions/fold-without-pending-raise.json",
      "sha256": "8991ad267dbcca4a9beeee854a3f27d47fdb2f1d8b5c800b10b0208d75dd0ab2"
    },
    {
      "bytes": 1379,
      "path": "engine/fixtures/errors-and-invalid-actions/illegal-raise-target.json",
      "sha256": "1013dd64be53ba1efb2b47c079e68391f5ec76cc1917caa64d53f08181b52d5d"
    },
    {
      "bytes": 1372,
      "path": "engine/fixtures/errors-and-invalid-actions/out-of-turn-action.json",
      "sha256": "1a9e1d9742fb3474b5270fd6b8224dc195350b4576091f7a861a92f1365d6037"
    },
    {
      "bytes": 1527,
      "path": "engine/fixtures/errors-and-invalid-actions/re-raise-at-12-is-illegal.json",
      "sha256": "dbec452f2e8ff3c193fc323bc099677c3b87cb86c3bceea66d01531e937fd731"
    },
    {
      "bytes": 1721,
      "path": "engine/fixtures/errors-and-invalid-actions/same-player-cannot-reraise-immediately-after-accept.json",
      "sha256": "df94b4a2c5a7b9bb987e75d54f8a49f424262d1ab2b156df0136b54cbbaf21ee"
    },
    {
      "bytes": 2571,
      "path": "engine/fixtures/hand-resolution/all-three-rounds-tied.json",
      "sha256": "97990bb1150ae56c769019a90cedb130b06048c6c78b7b5a7c9cadd40dfd6e1c"
    },
    {
      "bytes": 2221,
      "path": "engine/fixtures/hand-resolution/first-round-tie-second-round-win.json",
      "sha256": "3ec0dfd7cd45ea9cf73475790c3e5fccd51b87c47f4f37bdb9c8a4ab1b2ae728"
    },
    {
      "bytes": 2185,
      "path": "engine/fixtures/hand-resolution/first-two-rounds-win.json",
      "sha256": "a650c2c28fdf8bd5c24cff1d406adfcd99ad8f6cda673031729b34c045728a06"
    },
    {
      "bytes": 2212,
      "path": "engine/fixtures/hand-resolution/win-plus-tie.json",
      "sha256": "43d60c6860dd6fa7b5474711a34dfb60fad4ea7ba50f23c71f3e11966bb1f809"
    },
    {
      "bytes": 2072,
      "path": "engine/fixtures/hidden-cards/cannot-hide-first-round.json",
      "sha256": "195a8df30d9c01f2150319b22d346925a724e928c8b57a5a19735834b663fbf2"
    },
    {
      "bytes": 1789,
      "path": "engine/fixtures/hidden-cards/hidden-card-stays-hidden-in-public-state.json",
      "sha256": "d7b124fe053dd292ee9cc4fad5fab2de861e5af9f8adbc6cf67e0864b6b1b097"
    },
    {
      "bytes": 2144,
      "path": "engine/fixtures/hidden-cards/hidden-vs-hidden-round-ties.json",
      "sha256": "b572e9e63665e4a56ff042cd96a54f217984fdb03e8e25ba2b3fcadbd741b52c"
    },
    {
      "bytes": 2258,
      "path": "engine/fixtures/hidden-cards/hide-allowed-from-second-round.json",
      "sha256": "296aedc46208455a786a276e669ae653489581bdb20a53b77ac515ae6aa64187"
    },
    {
      "bytes": 1878,
      "path": "engine/fixtures/hidden-cards/visible-card-beats-hidden-card.json",
      "sha256": "e8a6508876123c9de54f9949173bdaaeda475edde64dac4ebe3c6ae30bf6fcca"
    },
    {
      "bytes": 1305,
      "path": "engine/fixtures/invalid-states/both-players-on-11-must-start-at-3.json",
      "sha256": "da64912987ce148e76a29e29d2a6279b8cf6bbaf440eb0f573443dc9ecc1f0a7"
    },
    {
      "bytes": 1024,
      "path": "engine/fixtures/invalid-states/broken-inter-round-leader-chain.json",
      "sha256": "119f3c5e45858ae8eeb373476cebcffc99f69104a30c356e654a57532f9f29d3"
    },
    {
      "bytes": 1140,
      "path": "engine/fixtures/invalid-states/dealer-led-first-round.json",
      "sha256": "4ab10b452a1dea37149154fa3fcb57292303932a2ad5e0c1e8b127d788dc3c32"
    },
    {
      "bytes": 1309,
      "path": "engine/fixtures/invalid-states/eleven-hand-at-value-1-without-decision.json",
      "sha256": "430f09a3750b81edf9433ed5f84f5ae2ad83f030eafda3aa0be6b5bb0998c7fc"
    },
    {
      "bytes": 989,
      "path": "engine/fixtures/invalid-states/hand-continues-after-two-round-win.json",
      "sha256": "8e4610a2a0457d6f9cb909f86bf96128c697f5f0fc8d6b877a4869f90a7eb567"
    },
    {
      "bytes": 1306,
      "path": "engine/fixtures/invalid-states/hidden-play-in-first-round.json",
      "sha256": "81172f57949d9272bc3afd7ffe3df4cbc816fb93c1f300a5acdf29e19162f536"
    },
    {
      "bytes": 1164,
      "path": "engine/fixtures/invalid-states/impossible-card-counts-after-history.json",
      "sha256": "675b15093fefb2493c30c3b249846b43cc3db02b567b81a638ee910d6357d4ac"
    },
    {
      "bytes": 1261,
      "path": "engine/fixtures/invalid-states/live-hand-with-match-already-won.json",
      "sha256": "646d9f8d15651723030c8e9359e33b8d30d31f3959533b4abb9b0e438942163a"
    },
    {
      "bytes": 1228,
      "path": "engine/fixtures/invalid-states/next-player-disagrees-with-current-round.json",
      "sha256": "8fb35e225ec5c9851f7b6fae2a5d21594b2f6f9dcd28e88962342125a0abe607"
    },
    {
      "bytes": 1374,
      "path": "engine/fixtures/invalid-states/pending-mao-de-onze-when-both-players-on-11.json",
      "sha256": "12cb6c42e2a69f6d7750acf737610354d0c4b51aca562d4a1908584593a88108"
    },
    {
      "bytes": 1381,
      "path": "engine/fixtures/invalid-states/pending-raise-during-mao-de-onze.json",
      "sha256": "8ed0726720439a851fed5c0ba95f6836c1ad1702fc739e67c07826c186a98175"
    },
    {
      "bytes": 1394,
      "path": "engine/fixtures/invalid-states/pending-raise-in-accepted-eleven-hand.json",
      "sha256": "c37280c03626c7412d48323784b6659aa07251309c8ddb66ca790bd1ef8655b7"
    },
    {
      "bytes": 1697,
      "path": "engine/fixtures/raises/accepted-raise-does-not-let-same-player-reraise-immediately.json",
      "sha256": "51536b5b300d9025d715944ae4c8cc366fb93e669ed6892a2ff278205fcf60f6"
    },
    {
      "bytes": 2281,